{
    "$schema": "http://json-schema.org/draft-07/schema#",
    "$id": "https://www.drbsclasses.org/student49/node/info/example1.schema.json",
    "title": "Activity Data Schema",
    "description": "A Schema that requires a JSON object",
    "type": "object",
    "properties": {
        "date": {
            "type": "string",
            "pattern": "[0-9][0-9]/[0-9][0-9]/[0-9][0-9][0-9][0-9]"
        },
        "movie":{
            "type": "string",
            "minLength":1,
            "maxLength": 40
        },
        "description": {
            "type": "string",
            "maxLength": 300
        },
        "time": {
            "type": "string",
            "maxLength": 10
        }
    },
    "required": ["date", "movie","time"],
    "additionalProperties": false
  }
  