{
    "date":"12/09/2020",
    "movie":"Harry Potter Series",
    "description":"Harry Potter is a film series based on the eponymous novels by author J. K. Rowling. The series is distributed by Warner Bros. and consists of eight fantasy films, beginning with Harry Potter and the Philosopher's Stone and culminating with Harry Potter and the Deathly Hallows â€“ Part 2.",
    "time":"20 hours"
  }