[
  {
    "date": "12/09/2020",
    "movie": "Harry Potter Series",
    "description": "Harry Potter is a film series based on the eponymous novels by author J. K. Rowling. The series is distributed by Warner Bros. and consists of eight fantasy films, beginning with Harry Potter and the Philosopher's Stone and culminating with Harry Potter and the Deathly Hallows â€“ Part 2.",
    "time": "20 hours"
  },
  {
    "date": "19/09/2020",
    "movie": "Iron Man",
    "description": "Iron Man is a fictional superhero appearing in American comic books published by Marvel Comics.",
    "time": "6 hours"
  },
  {
    "date": "26/09/2020",
    "movie": "The Hobbit",
    "description": "The Hobbit is a film series consisting of three high fantasy adventure films directed by Peter Jackson. They are based on the 1937 novel The Hobbit by J. R. R.",
    "time": "8.5 hours"
  }
]
